12:03:48.276097 IP 172.26.0.4.49498 > 172.26.0.3.5558: Flags [S], seq 3833398765, win 29200, options [mss 1460,sackOK,TS val 344132408 ecr 0,nop,wscale 7], length 0
12:03:48.276222 IP 172.26.0.3.5558 > 172.26.0.4.49498: Flags [R.], seq 0, ack 3833398766, win 0, length 0
12:03:48.463501 IP 172.26.0.4.49500 > 172.26.0.3.5558: Flags [S], seq 1536127624, win 29200, options [mss 1460,sackOK,TS val 344132596 ecr 0,nop,wscale 7], length 0
12:03:48.463746 IP 172.26.0.3.5558 > 172.26.0.4.49500: Flags [R.], seq 0, ack 1536127625, win 0, length 0
12:03:48.594687 IP 172.26.0.4.49502 > 172.26.0.3.5558: Flags [S], seq 3447267914, win 29200, options [mss 1460,sackOK,TS val 344132727 ecr 0,nop,wscale 7], length 0
12:03:48.594785 IP 172.26.0.3.5558 > 172.26.0.4.49502: Flags [R.], seq 0, ack 3447267915, win 0, length 0
12:03:48.738654 IP 172.26.0.4.49504 > 172.26.0.3.5558: Flags [S], seq 3019835889, win 29200, options [mss 1460,sackOK,TS val 344132871 ecr 0,nop,wscale 7], length 0
12:03:48.738698 IP 172.26.0.3.5558 > 172.26.0.4.49504: Flags [R.], seq 0, ack 3019835890, win 0, length 0
12:03:48.927754 IP 172.26.0.4.49506 > 172.26.0.3.5558: Flags [S], seq 3456670288, win 29200, options [mss 1460,sackOK,TS val 344133060 ecr 0,nop,wscale 7], length 0
12:03:48.927836 IP 172.26.0.3.5558 > 172.26.0.4.49506: Flags [R.], seq 0, ack 3456670289, win 0, length 0
12:03:49.127597 IP 172.26.0.4.49508 > 172.26.0.3.5558: Flags [S], seq 1045132513, win 29200, options [mss 1460,sackOK,TS val 344133260 ecr 0,nop,wscale 7], length 0
12:03:49.127672 IP 172.26.0.3.5558 > 172.26.0.4.49508: Flags [R.], seq 0, ack 1045132514, win 0, length 0
12:03:49.241776 IP 172.26.0.4.49510 > 172.26.0.3.5558: Flags [S], seq 1032178846, win 29200, options [mss 1460,sackOK,TS val 344133374 ecr 0,nop,wscale 7], length 0
12:03:49.241815 IP 172.26.0.3.5558 > 172.26.0.4.49510: Flags [R.], seq 0, ack 1032178847, win 0, length 0
12:03:49.382911 IP 172.26.0.4.49512 > 172.26.0.3.5558: Flags [S], seq 1854319310, win 29200, options [mss 1460,sackOK,TS val 344133515 ecr 0,nop,wscale 7], length 0
12:03:49.382944 IP 172.26.0.3.5558 > 172.26.0.4.49512: Flags [R.], seq 0, ack 1854319311, win 0, length 0
12:03:49.397592 IP 172.26.0.2.36176 > 172.26.0.4.5557: Flags [S], seq 2807856200, win 29200, options [mss 1460,sackOK,TS val 3997104667 ecr 0,nop,wscale 7], length 0
12:03:49.397767 IP 172.26.0.4.5557 > 172.26.0.2.36176: Flags [S.], seq 500963925, ack 2807856201, win 28960, options [mss 1460,sackOK,TS val 804549500 ecr 3997104667,nop,wscale 7], length 0
12:03:49.397968 IP 172.26.0.2.36176 > 172.26.0.4.5557: Flags [.], ack 1, win 229, options [nop,nop,TS val 3997104668 ecr 804549500], length 0
12:03:49.399623 IP 172.26.0.4.5557 > 172.26.0.2.36176: Flags [P.], seq 1:11, ack 1, win 227, options [nop,nop,TS val 804549502 ecr 3997104668], length 10
12:03:49.399694 IP 172.26.0.2.36176 > 172.26.0.4.5557: Flags [.], ack 11, win 229, options [nop,nop,TS val 3997104669 ecr 804549502], length 0
12:03:49.402542 IP 172.26.0.2.34340 > 172.26.0.3.5558: Flags [S], seq 3121303233, win 29200, options [mss 1460,sackOK,TS val 3569681109 ecr 0,nop,wscale 7], length 0
12:03:49.402576 IP 172.26.0.3.5558 > 172.26.0.2.34340: Flags [R.], seq 0, ack 3121303234, win 0, length 0
12:03:49.403106 IP 172.26.0.2.36176 > 172.26.0.4.5557: Flags [P.], seq 1:12, ack 11, win 229, options [nop,nop,TS val 3997104673 ecr 804549502], length 11
12:03:49.403182 IP 172.26.0.4.5557 > 172.26.0.2.36176: Flags [.], ack 12, win 227, options [nop,nop,TS val 804549506 ecr 3997104673], length 0
12:03:49.403686 IP 172.26.0.4.5557 > 172.26.0.2.36176: Flags [P.], seq 11:65, ack 12, win 227, options [nop,nop,TS val 804549506 ecr 3997104673], length 54
12:03:49.404368 IP 172.26.0.2.36176 > 172.26.0.4.5557: Flags [P.], seq 12:65, ack 65, win 229, options [nop,nop,TS val 3997104674 ecr 804549506], length 53
12:03:49.404790 IP 172.26.0.2.36176 > 172.26.0.4.5557: Flags [P.], seq 65:93, ack 65, win 229, options [nop,nop,TS val 3997104674 ecr 804549506], length 28
12:03:49.404819 IP 172.26.0.4.5557 > 172.26.0.2.36176: Flags [P.], seq 65:93, ack 93, win 227, options [nop,nop,TS val 804549507 ecr 3997104674], length 28
12:03:49.446812 IP 172.26.0.2.36176 > 172.26.0.4.5557: Flags [.], ack 93, win 229, options [nop,nop,TS val 3997104716 ecr 804549507], length 0
12:03:49.550614 IP 172.26.0.4.49518 > 172.26.0.3.5558: Flags [S], seq 840201819, win 29200, options [mss 1460,sackOK,TS val 344133683 ecr 0,nop,wscale 7], length 0
12:03:49.550789 IP 172.26.0.3.5558 > 172.26.0.4.49518: Flags [R.], seq 0, ack 840201820, win 0, length 0
12:03:49.590846 IP 172.26.0.2.34344 > 172.26.0.3.5558: Flags [S], seq 2752256894, win 29200, options [mss 1460,sackOK,TS val 3569681297 ecr 0,nop,wscale 7], length 0
12:03:49.590954 IP 172.26.0.3.5558 > 172.26.0.2.34344: Flags [R.], seq 0, ack 2752256895, win 0, length 0
12:03:49.836604 IP 172.26.0.2.34346 > 172.26.0.3.5558: Flags [S], seq 1504570499, win 29200, options [mss 1460,sackOK,TS val 3569681543 ecr 0,nop,wscale 7], length 0
12:03:49.836699 IP 172.26.0.3.5558 > 172.26.0.2.34346: Flags [R.], seq 0, ack 1504570500, win 0, length 0
12:03:49.838975 IP 172.26.0.4.49524 > 172.26.0.3.5558: Flags [S], seq 3598184790, win 29200, options [mss 1460,sackOK,TS val 344133972 ecr 0,nop,wscale 7], length 0
12:03:49.839057 IP 172.26.0.3.5558 > 172.26.0.4.49524: Flags [R.], seq 0, ack 3598184791, win 0, length 0
12:03:49.979989 IP 172.26.0.2.34350 > 172.26.0.3.5558: Flags [S], seq 4081201025, win 29200, options [mss 1460,sackOK,TS val 3569681687 ecr 0,nop,wscale 7], length 0
12:03:49.980037 IP 172.26.0.3.5558 > 172.26.0.2.34350: Flags [R.], seq 0, ack 4081201026, win 0, length 0
12:03:50.015192 IP 172.26.0.4.49528 > 172.26.0.3.5558: Flags [S], seq 1126651010, win 29200, options [mss 1460,sackOK,TS val 344134148 ecr 0,nop,wscale 7], length 0
12:03:50.015247 IP 172.26.0.3.5558 > 172.26.0.4.49528: Flags [R.], seq 0, ack 1126651011, win 0, length 0
12:03:50.128703 IP 172.26.0.4.49530 > 172.26.0.3.5558: Flags [S], seq 1137112850, win 29200, options [mss 1460,sackOK,TS val 344134261 ecr 0,nop,wscale 7], length 0
12:03:50.128826 IP 172.26.0.3.5558 > 172.26.0.4.49530: Flags [R.], seq 0, ack 1137112851, win 0, length 0
12:03:50.171031 IP 172.26.0.2.34356 > 172.26.0.3.5558: Flags [S], seq 4111124292, win 29200, options [mss 1460,sackOK,TS val 3569681878 ecr 0,nop,wscale 7], length 0
12:03:50.171070 IP 172.26.0.3.5558 > 172.26.0.2.34356: Flags [R.], seq 0, ack 4111124293, win 0, length 0
12:03:50.252683 IP 172.26.0.4.49534 > 172.26.0.3.5558: Flags [S], seq 3195919219, win 29200, options [mss 1460,sackOK,TS val 344134385 ecr 0,nop,wscale 7], length 0
12:03:50.252759 IP 172.26.0.3.5558 > 172.26.0.4.49534: Flags [R.], seq 0, ack 3195919220, win 0, length 0
12:03:50.370299 IP 172.26.0.2.34360 > 172.26.0.3.5558: Flags [S], seq 67324841, win 29200, options [mss 1460,sackOK,TS val 3569682077 ecr 0,nop,wscale 7], length 0
12:03:50.370546 IP 172.26.0.3.5558 > 172.26.0.2.34360: Flags [R.], seq 0, ack 67324842, win 0, length 0
12:03:50.442564 IP 172.26.0.4.49538 > 172.26.0.3.5558: Flags [S], seq 2164202762, win 29200, options [mss 1460,sackOK,TS val 344134575 ecr 0,nop,wscale 7], length 0
12:03:50.442628 IP 172.26.0.3.5558 > 172.26.0.4.49538: Flags [R.], seq 0, ack 2164202763, win 0, length 0
12:03:50.484162 IP 172.26.0.2.34364 > 172.26.0.3.5558: Flags [S], seq 116707257, win 29200, options [mss 1460,sackOK,TS val 3569682191 ecr 0,nop,wscale 7], length 0
12:03:50.484227 IP 172.26.0.3.5558 > 172.26.0.2.34364: Flags [R.], seq 0, ack 116707258, win 0, length 0
12:03:50.556235 IP 172.26.0.4.49542 > 172.26.0.3.5558: Flags [S], seq 533645138, win 29200, options [mss 1460,sackOK,TS val 344134689 ecr 0,nop,wscale 7], length 0
12:03:50.556332 IP 172.26.0.3.5558 > 172.26.0.4.49542: Flags [R.], seq 0, ack 533645139, win 0, length 0
12:03:50.625344 IP 172.26.0.2.34368 > 172.26.0.3.5558: Flags [S], seq 3374840764, win 29200, options [mss 1460,sackOK,TS val 3569682332 ecr 0,nop,wscale 7], length 0
12:03:50.625520 IP 172.26.0.3.5558 > 172.26.0.2.34368: Flags [R.], seq 0, ack 3374840765, win 0, length 0
12:03:50.673385 IP 172.26.0.4.49546 > 172.26.0.3.5558: Flags [S], seq 3326171296, win 29200, options [mss 1460,sackOK,TS val 344134806 ecr 0,nop,wscale 7], length 0
12:03:50.673589 IP 172.26.0.3.5558 > 172.26.0.4.49546: Flags [R.], seq 0, ack 3326171297, win 0, length 0
12:03:50.790578 IP 172.26.0.2.34372 > 172.26.0.3.5558: Flags [S], seq 461699106, win 29200, options [mss 1460,sackOK,TS val 3569682497 ecr 0,nop,wscale 7], length 0
12:03:50.790623 IP 172.26.0.3.5558 > 172.26.0.2.34372: Flags [R.], seq 0, ack 461699107, win 0, length 0
12:03:50.804833 IP 172.26.0.4.49550 > 172.26.0.3.5558: Flags [S], seq 1247033296, win 29200, options [mss 1460,sackOK,TS val 344134937 ecr 0,nop,wscale 7], length 0
12:03:50.804892 IP 172.26.0.3.5558 > 172.26.0.4.49550: Flags [R.], seq 0, ack 1247033297, win 0, length 0
12:03:50.931177 IP 172.26.0.4.49552 > 172.26.0.3.5558: Flags [S], seq 1774911305, win 29200, options [mss 1460,sackOK,TS val 344135064 ecr 0,nop,wscale 7], length 0
12:03:50.931253 IP 172.26.0.3.5558 > 172.26.0.4.49552: Flags [S.], seq 3984377350, ack 1774911306, win 28960, options [mss 1460,sackOK,TS val 233591669 ecr 344135064,nop,wscale 7], length 0
12:03:50.931410 IP 172.26.0.4.49552 > 172.26.0.3.5558: Flags [.], ack 1, win 229, options [nop,nop,TS val 344135064 ecr 233591669], length 0
12:03:50.932162 IP 172.26.0.3.5558 > 172.26.0.4.49552: Flags [P.], seq 1:11, ack 1, win 227, options [nop,nop,TS val 233591670 ecr 344135064], length 10
12:03:50.932219 IP 172.26.0.4.49552 > 172.26.0.3.5558: Flags [.], ack 11, win 229, options [nop,nop,TS val 344135065 ecr 233591670], length 0
12:03:50.932339 IP 172.26.0.4.49552 > 172.26.0.3.5558: Flags [P.], seq 1:12, ack 11, win 229, options [nop,nop,TS val 344135065 ecr 233591670], length 11
12:03:50.932367 IP 172.26.0.3.5558 > 172.26.0.4.49552: Flags [.], ack 12, win 227, options [nop,nop,TS val 233591670 ecr 344135065], length 0
12:03:50.932550 IP 172.26.0.2.p-net-local > 172.26.0.3.5558: Flags [S], seq 2970962219, win 29200, options [mss 1460,sackOK,TS val 3569682639 ecr 0,nop,wscale 7], length 0
12:03:50.932677 IP 172.26.0.3.5558 > 172.26.0.2.p-net-local: Flags [S.], seq 1523621777, ack 2970962220, win 28960, options [mss 1460,sackOK,TS val 2755130257 ecr 3569682639,nop,wscale 7], length 0
12:03:50.932781 IP 172.26.0.2.p-net-local > 172.26.0.3.5558: Flags [.], ack 1, win 229, options [nop,nop,TS val 3569682639 ecr 2755130257], length 0
12:03:50.933025 IP 172.26.0.3.5558 > 172.26.0.4.49552: Flags [P.], seq 11:65, ack 12, win 227, options [nop,nop,TS val 233591671 ecr 344135065], length 54
12:03:50.933326 IP 172.26.0.3.5558 > 172.26.0.2.p-net-local: Flags [P.], seq 1:11, ack 1, win 227, options [nop,nop,TS val 2755130258 ecr 3569682639], length 10
12:03:50.933544 IP 172.26.0.2.p-net-local > 172.26.0.3.5558: Flags [.], ack 11, win 229, options [nop,nop,TS val 3569682640 ecr 2755130258], length 0
12:03:50.933843 IP 172.26.0.2.p-net-local > 172.26.0.3.5558: Flags [P.], seq 1:12, ack 11, win 229, options [nop,nop,TS val 3569682640 ecr 2755130258], length 11
12:03:50.933901 IP 172.26.0.3.5558 > 172.26.0.2.p-net-local: Flags [.], ack 12, win 227, options [nop,nop,TS val 2755130259 ecr 3569682640], length 0
12:03:50.934039 IP 172.26.0.3.5558 > 172.26.0.2.p-net-local: Flags [P.], seq 11:65, ack 12, win 227, options [nop,nop,TS val 2755130259 ecr 3569682640], length 54
12:03:50.934281 IP 172.26.0.2.p-net-local > 172.26.0.3.5558: Flags [P.], seq 12:65, ack 65, win 229, options [nop,nop,TS val 3569682641 ecr 2755130259], length 53
12:03:50.934420 IP 172.26.0.3.5558 > 172.26.0.2.p-net-local: Flags [P.], seq 65:93, ack 65, win 227, options [nop,nop,TS val 2755130259 ecr 3569682641], length 28
12:03:50.934814 IP 172.26.0.2.p-net-local > 172.26.0.3.5558: Flags [P.], seq 65:93, ack 93, win 229, options [nop,nop,TS val 3569682641 ecr 2755130259], length 28
12:03:50.935198 IP 172.26.0.4.49552 > 172.26.0.3.5558: Flags [P.], seq 12:65, ack 65, win 229, options [nop,nop,TS val 344135068 ecr 233591671], length 53
12:03:50.935352 IP 172.26.0.3.5558 > 172.26.0.4.49552: Flags [P.], seq 65:93, ack 65, win 227, options [nop,nop,TS val 233591673 ecr 344135068], length 28
12:03:50.935490 IP 172.26.0.4.49552 > 172.26.0.3.5558: Flags [P.], seq 65:93, ack 65, win 229, options [nop,nop,TS val 344135068 ecr 233591671], length 28
12:03:50.976656 IP 172.26.0.3.5558 > 172.26.0.4.49552: Flags [.], ack 93, win 227, options [nop,nop,TS val 233591714 ecr 344135068], length 0
12:03:50.976686 IP 172.26.0.3.5558 > 172.26.0.2.p-net-local: Flags [.], ack 93, win 227, options [nop,nop,TS val 2755130301 ecr 3569682641], length 0
12:03:50.976754 IP 172.26.0.4.49552 > 172.26.0.3.5558: Flags [.], ack 93, win 229, options [nop,nop,TS val 344135109 ecr 233591673], length 0
12:03:54.714891 IP 172.26.0.4.49552 > 172.26.0.3.5558: Flags [P.], seq 93:96, ack 93, win 229, options [nop,nop,TS val 344138847 ecr 233591714], length 3
12:03:54.714936 IP 172.26.0.3.5558 > 172.26.0.4.49552: Flags [.], ack 96, win 227, options [nop,nop,TS val 233595453 ecr 344138847], length 0
12:03:54.715090 IP 172.26.0.4.5557 > 172.26.0.2.36176: Flags [P.], seq 93:431, ack 93, win 227, options [nop,nop,TS val 804554818 ecr 3997104716], length 338
12:03:54.715156 IP 172.26.0.2.36176 > 172.26.0.4.5557: Flags [.], ack 431, win 237, options [nop,nop,TS val 3997109985 ecr 804554818], length 0
12:03:54.715210 IP 172.26.0.4.5557 > 172.26.0.2.36176: Flags [P.], seq 431:483, ack 93, win 227, options [nop,nop,TS val 804554818 ecr 3997109985], length 52
12:03:54.715260 IP 172.26.0.2.36176 > 172.26.0.4.5557: Flags [.], ack 483, win 237, options [nop,nop,TS val 3997109985 ecr 804554818], length 0
12:03:54.715333 IP 172.26.0.4.5557 > 172.26.0.2.36176: Flags [P.], seq 483:487, ack 93, win 227, options [nop,nop,TS val 804554818 ecr 3997109985], length 4
12:03:54.715373 IP 172.26.0.2.36176 > 172.26.0.4.5557: Flags [.], ack 487, win 237, options [nop,nop,TS val 3997109985 ecr 804554818], length 0
12:03:54.719714 IP 172.26.0.2.p-net-local > 172.26.0.3.5558: Flags [P.], seq 93:95, ack 93, win 229, options [nop,nop,TS val 3569686426 ecr 2755130301], length 2
12:03:54.719813 IP 172.26.0.3.5558 > 172.26.0.2.p-net-local: Flags [.], ack 95, win 227, options [nop,nop,TS val 2755134044 ecr 3569686426], length 0
12:03:54.777656 IP 172.26.0.2.p-net-local > 172.26.0.3.5558: Flags [P.], seq 95:97, ack 93, win 229, options [nop,nop,TS val 3569686484 ecr 2755134044], length 2
12:03:54.777688 IP 172.26.0.3.5558 > 172.26.0.2.p-net-local: Flags [.], ack 97, win 227, options [nop,nop,TS val 2755134102 ecr 3569686484], length 0
12:03:54.842376 IP 172.26.0.2.p-net-local > 172.26.0.3.5558: Flags [P.], seq 97:99, ack 93, win 229, options [nop,nop,TS val 3569686549 ecr 2755134102], length 2
12:03:54.842576 IP 172.26.0.3.5558 > 172.26.0.2.p-net-local: Flags [.], ack 99, win 227, options [nop,nop,TS val 2755134167 ecr 3569686549], length 0
12:03:54.906991 IP 172.26.0.2.p-net-local > 172.26.0.3.5558: Flags [P.], seq 99:101, ack 93, win 229, options [nop,nop,TS val 3569686614 ecr 2755134167], length 2
12:03:54.907069 IP 172.26.0.3.5558 > 172.26.0.2.p-net-local: Flags [.], ack 101, win 227, options [nop,nop,TS val 2755134232 ecr 3569686614], length 0
12:03:54.910582 IP 172.26.0.2.p-net-local > 172.26.0.3.5558: Flags [P.], seq 101:103, ack 93, win 229, options [nop,nop,TS val 3569686617 ecr 2755134232], length 2
12:03:54.910637 IP 172.26.0.3.5558 > 172.26.0.2.p-net-local: Flags [.], ack 103, win 227, options [nop,nop,TS val 2755134235 ecr 3569686617], length 0
12:03:54.976719 IP 172.26.0.2.p-net-local > 172.26.0.3.5558: Flags [P.], seq 103:105, ack 93, win 229, options [nop,nop,TS val 3569686683 ecr 2755134235], length 2
12:03:54.976790 IP 172.26.0.3.5558 > 172.26.0.2.p-net-local: Flags [.], ack 105, win 227, options [nop,nop,TS val 2755134301 ecr 3569686683], length 0
12:03:55.043045 IP 172.26.0.2.p-net-local > 172.26.0.3.5558: Flags [P.], seq 105:107, ack 93, win 229, options [nop,nop,TS val 3569686750 ecr 2755134301], length 2
12:03:55.043081 IP 172.26.0.3.5558 > 172.26.0.2.p-net-local: Flags [.], ack 107, win 227, options [nop,nop,TS val 2755134368 ecr 3569686750], length 0
12:03:55.057736 IP 172.26.0.2.p-net-local > 172.26.0.3.5558: Flags [P.], seq 107:109, ack 93, win 229, options [nop,nop,TS val 3569686764 ecr 2755134368], length 2
12:03:55.057788 IP 172.26.0.3.5558 > 172.26.0.2.p-net-local: Flags [.], ack 109, win 227, options [nop,nop,TS val 2755134382 ecr 3569686764], length 0
12:03:55.086879 IP 172.26.0.2.p-net-local > 172.26.0.3.5558: Flags [P.], seq 109:111, ack 93, win 229, options [nop,nop,TS val 3569686793 ecr 2755134382], length 2
12:03:55.086916 IP 172.26.0.3.5558 > 172.26.0.2.p-net-local: Flags [.], ack 111, win 227, options [nop,nop,TS val 2755134412 ecr 3569686793], length 0
12:03:55.135146 IP 172.26.0.2.p-net-local > 172.26.0.3.5558: Flags [P.], seq 111:113, ack 93, win 229, options [nop,nop,TS val 3569686842 ecr 2755134412], length 2
12:03:55.135200 IP 172.26.0.3.5558 > 172.26.0.2.p-net-local: Flags [.], ack 113, win 227, options [nop,nop,TS val 2755134460 ecr 3569686842], length 0
12:03:55.188248 IP 172.26.0.2.p-net-local > 172.26.0.3.5558: Flags [P.], seq 113:115, ack 93, win 229, options [nop,nop,TS val 3569686895 ecr 2755134460], length 2
12:03:55.188331 IP 172.26.0.3.5558 > 172.26.0.2.p-net-local: Flags [.], ack 115, win 227, options [nop,nop,TS val 2755134513 ecr 3569686895], length 0
12:03:55.204725 IP 172.26.0.2.p-net-local > 172.26.0.3.5558: Flags [P.], seq 115:117, ack 93, win 229, options [nop,nop,TS val 3569686911 ecr 2755134513], length 2
12:03:55.204769 IP 172.26.0.3.5558 > 172.26.0.2.p-net-local: Flags [.], ack 117, win 227, options [nop,nop,TS val 2755134529 ecr 3569686911], length 0
12:03:55.304223 IP 172.26.0.2.p-net-local > 172.26.0.3.5558: Flags [P.], seq 117:119, ack 93, win 229, options [nop,nop,TS val 3569687011 ecr 2755134529], length 2
12:03:55.304297 IP 172.26.0.3.5558 > 172.26.0.2.p-net-local: Flags [.], ack 119, win 227, options [nop,nop,TS val 2755134629 ecr 3569687011], length 0
12:03:55.362026 IP 172.26.0.2.p-net-local > 172.26.0.3.5558: Flags [P.], seq 119:121, ack 93, win 229, options [nop,nop,TS val 3569687069 ecr 2755134629], length 2
12:03:55.362091 IP 172.26.0.3.5558 > 172.26.0.2.p-net-local: Flags [.], ack 121, win 227, options [nop,nop,TS val 2755134687 ecr 3569687069], length 0
12:03:55.458641 IP 172.26.0.2.p-net-local > 172.26.0.3.5558: Flags [P.], seq 121:123, ack 93, win 229, options [nop,nop,TS val 3569687165 ecr 2755134687], length 2
12:03:55.458717 IP 172.26.0.3.5558 > 172.26.0.2.p-net-local: Flags [.], ack 123, win 227, options [nop,nop,TS val 2755134783 ecr 3569687165], length 0
12:03:55.556221 IP 172.26.0.2.p-net-local > 172.26.0.3.5558: Flags [P.], seq 123:125, ack 93, win 229, options [nop,nop,TS val 3569687263 ecr 2755134783], length 2
12:03:55.556260 IP 172.26.0.3.5558 > 172.26.0.2.p-net-local: Flags [.], ack 125, win 227, options [nop,nop,TS val 2755134881 ecr 3569687263], length 0
12:03:55.585230 IP 172.26.0.2.p-net-local > 172.26.0.3.5558: Flags [P.], seq 125:127, ack 93, win 229, options [nop,nop,TS val 3569687292 ecr 2755134881], length 2
12:03:55.585322 IP 172.26.0.3.5558 > 172.26.0.2.p-net-local: Flags [.], ack 127, win 227, options [nop,nop,TS val 2755134910 ecr 3569687292], length 0
12:03:55.628810 IP 172.26.0.2.p-net-local > 172.26.0.3.5558: Flags [P.], seq 127:129, ack 93, win 229, options [nop,nop,TS val 3569687335 ecr 2755134910], length 2
12:03:55.629128 IP 172.26.0.3.5558 > 172.26.0.2.p-net-local: Flags [.], ack 129, win 227, options [nop,nop,TS val 2755134954 ecr 3569687335], length 0
12:03:55.695094 IP 172.26.0.2.p-net-local > 172.26.0.3.5558: Flags [P.], seq 129:131, ack 93, win 229, options [nop,nop,TS val 3569687402 ecr 2755134954], length 2
12:03:55.695296 IP 172.26.0.3.5558 > 172.26.0.2.p-net-local: Flags [.], ack 131, win 227, options [nop,nop,TS val 2755135020 ecr 3569687402], length 0
12:03:55.722756 IP 172.26.0.4.5557 > 172.26.0.2.36176: Flags [F.], seq 487, ack 93, win 227, options [nop,nop,TS val 804555825 ecr 3997109985], length 0
12:03:55.723080 IP 172.26.0.4.49552 > 172.26.0.3.5558: Flags [F.], seq 96, ack 93, win 229, options [nop,nop,TS val 344139856 ecr 233595453], length 0
12:03:55.723223 IP 172.26.0.2.36176 > 172.26.0.4.5557: Flags [F.], seq 93, ack 488, win 237, options [nop,nop,TS val 3997110993 ecr 804555825], length 0
12:03:55.723313 IP 172.26.0.4.5557 > 172.26.0.2.36176: Flags [.], ack 94, win 227, options [nop,nop,TS val 804555826 ecr 3997110993], length 0
12:03:55.723466 IP 172.26.0.3.5558 > 172.26.0.4.49552: Flags [F.], seq 93, ack 97, win 227, options [nop,nop,TS val 233596461 ecr 344139856], length 0
12:03:55.723541 IP 172.26.0.4.49552 > 172.26.0.3.5558: Flags [.], ack 94, win 229, options [nop,nop,TS val 344139856 ecr 233596461], length 0
12:03:55.742804 IP 172.26.0.2.p-net-local > 172.26.0.3.5558: Flags [P.], seq 131:133, ack 93, win 229, options [nop,nop,TS val 3569687449 ecr 2755135020], length 2
12:03:55.742966 IP 172.26.0.3.5558 > 172.26.0.2.p-net-local: Flags [.], ack 133, win 227, options [nop,nop,TS val 2755135068 ecr 3569687449], length 0
12:03:55.780165 IP 172.26.0.2.p-net-local > 172.26.0.3.5558: Flags [P.], seq 133:135, ack 93, win 229, options [nop,nop,TS val 3569687487 ecr 2755135068], length 2
12:03:55.780484 IP 172.26.0.3.5558 > 172.26.0.2.p-net-local: Flags [.], ack 135, win 227, options [nop,nop,TS val 2755135105 ecr 3569687487], length 0
12:03:55.795129 IP 172.26.0.2.p-net-local > 172.26.0.3.5558: Flags [P.], seq 135:137, ack 93, win 229, options [nop,nop,TS val 3569687502 ecr 2755135105], length 2
12:03:55.795521 IP 172.26.0.3.5558 > 172.26.0.2.p-net-local: Flags [.], ack 137, win 227, options [nop,nop,TS val 2755135120 ecr 3569687502], length 0
12:03:55.805582 IP 172.26.0.2.p-net-local > 172.26.0.3.5558: Flags [P.], seq 137:139, ack 93, win 229, options [nop,nop,TS val 3569687512 ecr 2755135120], length 2
12:03:55.805763 IP 172.26.0.3.5558 > 172.26.0.2.p-net-local: Flags [.], ack 139, win 227, options [nop,nop,TS val 2755135130 ecr 3569687512], length 0
12:03:55.882259 IP 172.26.0.2.p-net-local > 172.26.0.3.5558: Flags [P.], seq 139:141, ack 93, win 229, options [nop,nop,TS val 3569687589 ecr 2755135130], length 2
12:03:55.882676 IP 172.26.0.3.5558 > 172.26.0.2.p-net-local: Flags [.], ack 141, win 227, options [nop,nop,TS val 2755135207 ecr 3569687589], length 0
12:03:55.898258 IP 172.26.0.2.36218 > 172.26.0.4.5557: Flags [S], seq 328336618, win 29200, options [mss 1460,sackOK,TS val 3997111168 ecr 0,nop,wscale 7], length 0
12:03:55.898336 IP 172.26.0.4.5557 > 172.26.0.2.36218: Flags [R.], seq 0, ack 328336619, win 0, length 0
12:03:55.963630 IP 172.26.0.2.p-net-local > 172.26.0.3.5558: Flags [P.], seq 141:143, ack 93, win 229, options [nop,nop,TS val 3569687670 ecr 2755135207], length 2
12:03:55.963770 IP 172.26.0.3.5558 > 172.26.0.2.p-net-local: Flags [.], ack 143, win 227, options [nop,nop,TS val 2755135288 ecr 3569687670], length 0
12:03:56.012298 IP 172.26.0.2.36220 > 172.26.0.4.5557: Flags [S], seq 1485099894, win 29200, options [mss 1460,sackOK,TS val 3997111282 ecr 0,nop,wscale 7], length 0
12:03:56.012335 IP 172.26.0.4.5557 > 172.26.0.2.36220: Flags [R.], seq 0, ack 1485099895, win 0, length 0
12:03:56.028893 IP 172.26.0.2.p-net-local > 172.26.0.3.5558: Flags [P.], seq 143:145, ack 93, win 229, options [nop,nop,TS val 3569687735 ecr 2755135288], length 2
12:03:56.029305 IP 172.26.0.3.5558 > 172.26.0.2.p-net-local: Flags [.], ack 145, win 227, options [nop,nop,TS val 2755135354 ecr 3569687735], length 0
12:03:56.100088 IP 172.26.0.2.p-net-local > 172.26.0.3.5558: Flags [P.], seq 145:147, ack 93, win 229, options [nop,nop,TS val 3569687807 ecr 2755135354], length 2
12:03:56.100241 IP 172.26.0.3.5558 > 172.26.0.2.p-net-local: Flags [.], ack 147, win 227, options [nop,nop,TS val 2755135425 ecr 3569687807], length 0
12:03:56.133485 IP 172.26.0.2.36222 > 172.26.0.4.5557: Flags [S], seq 2361275215, win 29200, options [mss 1460,sackOK,TS val 3997111403 ecr 0,nop,wscale 7], length 0
12:03:56.133544 IP 172.26.0.4.5557 > 172.26.0.2.36222: Flags [R.], seq 0, ack 2361275216, win 0, length 0
12:03:56.133795 IP 172.26.0.2.p-net-local > 172.26.0.3.5558: Flags [P.], seq 147:149, ack 93, win 229, options [nop,nop,TS val 3569687840 ecr 2755135425], length 2
12:03:56.134085 IP 172.26.0.3.5558 > 172.26.0.2.p-net-local: Flags [.], ack 149, win 227, options [nop,nop,TS val 2755135459 ecr 3569687840], length 0
12:03:56.207635 IP 172.26.0.2.p-net-local > 172.26.0.3.5558: Flags [P.], seq 149:151, ack 93, win 229, options [nop,nop,TS val 3569687914 ecr 2755135459], length 2
12:03:56.207804 IP 172.26.0.3.5558 > 172.26.0.2.p-net-local: Flags [.], ack 151, win 227, options [nop,nop,TS val 2755135532 ecr 3569687914], length 0
12:03:56.284339 IP 172.26.0.2.p-net-local > 172.26.0.3.5558: Flags [P.], seq 151:153, ack 93, win 229, options [nop,nop,TS val 3569687991 ecr 2755135532], length 2
12:03:56.284681 IP 172.26.0.3.5558 > 172.26.0.2.p-net-local: Flags [.], ack 153, win 227, options [nop,nop,TS val 2755135609 ecr 3569687991], length 0
12:03:56.318926 IP 172.26.0.2.36224 > 172.26.0.4.5557: Flags [S], seq 2746562109, win 29200, options [mss 1460,sackOK,TS val 3997111588 ecr 0,nop,wscale 7], length 0
12:03:56.318983 IP 172.26.0.4.5557 > 172.26.0.2.36224: Flags [R.], seq 0, ack 2746562110, win 0, length 0
12:03:56.348749 IP 172.26.0.2.p-net-local > 172.26.0.3.5558: Flags [P.], seq 153:155, ack 93, win 229, options [nop,nop,TS val 3569688055 ecr 2755135609], length 2
12:03:56.348945 IP 172.26.0.3.5558 > 172.26.0.2.p-net-local: Flags [.], ack 155, win 227, options [nop,nop,TS val 2755135674 ecr 3569688055], length 0
12:03:56.367383 IP 172.26.0.2.p-net-local > 172.26.0.3.5558: Flags [P.], seq 155:157, ack 93, win 229, options [nop,nop,TS val 3569688074 ecr 2755135674], length 2
12:03:56.367780 IP 172.26.0.3.5558 > 172.26.0.2.p-net-local: Flags [.], ack 157, win 227, options [nop,nop,TS val 2755135692 ecr 3569688074], length 0
12:03:56.432123 IP 172.26.0.2.36226 > 172.26.0.4.5557: Flags [S], seq 2951542763, win 29200, options [mss 1460,sackOK,TS val 3997111702 ecr 0,nop,wscale 7], length 0
12:03:56.432165 IP 172.26.0.4.5557 > 172.26.0.2.36226: Flags [R.], seq 0, ack 2951542764, win 0, length 0
12:03:56.432411 IP 172.26.0.2.p-net-local > 172.26.0.3.5558: Flags [P.], seq 157:159, ack 93, win 229, options [nop,nop,TS val 3569688139 ecr 2755135692], length 2
12:03:56.432688 IP 172.26.0.3.5558 > 172.26.0.2.p-net-local: Flags [.], ack 159, win 227, options [nop,nop,TS val 2755135757 ecr 3569688139], length 0
12:03:56.448717 IP 172.26.0.2.p-net-local > 172.26.0.3.5558: Flags [P.], seq 159:161, ack 93, win 229, options [nop,nop,TS val 3569688155 ecr 2755135757], length 2
12:03:56.448872 IP 172.26.0.3.5558 > 172.26.0.2.p-net-local: Flags [.], ack 161, win 227, options [nop,nop,TS val 2755135773 ecr 3569688155], length 0
12:03:56.467712 IP 172.26.0.2.p-net-local > 172.26.0.3.5558: Flags [P.], seq 161:163, ack 93, win 229, options [nop,nop,TS val 3569688174 ecr 2755135773], length 2
12:03:56.467955 IP 172.26.0.3.5558 > 172.26.0.2.p-net-local: Flags [.], ack 163, win 227, options [nop,nop,TS val 2755135793 ecr 3569688174], length 0
12:03:56.550017 IP 172.26.0.2.36228 > 172.26.0.4.5557: Flags [S], seq 2994144107, win 29200, options [mss 1460,sackOK,TS val 3997111820 ecr 0,nop,wscale 7], length 0
12:03:56.550094 IP 172.26.0.4.5557 > 172.26.0.2.36228: Flags [R.], seq 0, ack 2994144108, win 0, length 0
12:03:56.554271 IP 172.26.0.2.p-net-local > 172.26.0.3.5558: Flags [P.], seq 163:165, ack 93, win 229, options [nop,nop,TS val 3569688261 ecr 2755135793], length 2
12:03:56.554613 IP 172.26.0.3.5558 > 172.26.0.2.p-net-local: Flags [.], ack 165, win 227, options [nop,nop,TS val 2755135879 ecr 3569688261], length 0
12:03:56.593036 IP 172.26.0.2.p-net-local > 172.26.0.3.5558: Flags [P.], seq 165:167, ack 93, win 229, options [nop,nop,TS val 3569688300 ecr 2755135879], length 2
12:03:56.593429 IP 172.26.0.3.5558 > 172.26.0.2.p-net-local: Flags [.], ack 167, win 227, options [nop,nop,TS val 2755135918 ecr 3569688300], length 0
12:03:56.604327 IP 172.26.0.2.p-net-local > 172.26.0.3.5558: Flags [P.], seq 167:169, ack 93, win 229, options [nop,nop,TS val 3569688311 ecr 2755135918], length 2
12:03:56.604534 IP 172.26.0.3.5558 > 172.26.0.2.p-net-local: Flags [.], ack 169, win 227, options [nop,nop,TS val 2755135929 ecr 3569688311], length 0
12:03:56.683950 IP 172.26.0.2.36230 > 172.26.0.4.5557: Flags [S], seq 3685751205, win 29200, options [mss 1460,sackOK,TS val 3997111954 ecr 0,nop,wscale 7], length 0
12:03:56.683995 IP 172.26.0.4.5557 > 172.26.0.2.36230: Flags [R.], seq 0, ack 3685751206, win 0, length 0
12:03:56.705700 IP 172.26.0.2.p-net-local > 172.26.0.3.5558: Flags [P.], seq 169:171, ack 93, win 229, options [nop,nop,TS val 3569688412 ecr 2755135929], length 2
12:03:56.705902 IP 172.26.0.3.5558 > 172.26.0.2.p-net-local: Flags [.], ack 171, win 227, options [nop,nop,TS val 2755136031 ecr 3569688412], length 0
12:03:56.773862 IP 172.26.0.2.p-net-local > 172.26.0.3.5558: Flags [P.], seq 171:173, ack 93, win 229, options [nop,nop,TS val 3569688480 ecr 2755136031], length 2
12:03:56.774008 IP 172.26.0.3.5558 > 172.26.0.2.p-net-local: Flags [.], ack 173, win 227, options [nop,nop,TS val 2755136099 ecr 3569688480], length 0
12:03:56.805055 IP 172.26.0.2.p-net-local > 172.26.0.3.5558: Flags [P.], seq 173:175, ack 93, win 229, options [nop,nop,TS val 3569688512 ecr 2755136099], length 2
12:03:56.805269 IP 172.26.0.3.5558 > 172.26.0.2.p-net-local: Flags [.], ack 175, win 227, options [nop,nop,TS val 2755136130 ecr 3569688512], length 0
12:03:56.811765 IP 172.26.0.2.36232 > 172.26.0.4.5557: Flags [S], seq 2094522727, win 29200, options [mss 1460,sackOK,TS val 3997112081 ecr 0,nop,wscale 7], length 0
12:03:56.811800 IP 172.26.0.4.5557 > 172.26.0.2.36232: Flags [R.], seq 0, ack 2094522728, win 0, length 0
12:03:56.890985 IP 172.26.0.2.p-net-local > 172.26.0.3.5558: Flags [P.], seq 175:177, ack 93, win 229, options [nop,nop,TS val 3569688598 ecr 2755136130], length 2
12:03:56.891070 IP 172.26.0.3.5558 > 172.26.0.2.p-net-local: Flags [.], ack 177, win 227, options [nop,nop,TS val 2755136216 ecr 3569688598], length 0
12:03:56.894288 IP 172.26.0.2.p-net-local > 172.26.0.3.5558: Flags [P.], seq 177:179, ack 93, win 229, options [nop,nop,TS val 3569688601 ecr 2755136216], length 2
12:03:56.894350 IP 172.26.0.3.5558 > 172.26.0.2.p-net-local: Flags [.], ack 179, win 227, options [nop,nop,TS val 2755136219 ecr 3569688601], length 0
12:03:56.934739 IP 172.26.0.2.36234 > 172.26.0.4.5557: Flags [S], seq 2415915047, win 29200, options [mss 1460,sackOK,TS val 3997112204 ecr 0,nop,wscale 7], length 0
12:03:56.934786 IP 172.26.0.4.5557 > 172.26.0.2.36234: Flags [R.], seq 0, ack 2415915048, win 0, length 0
12:03:56.938920 IP 172.26.0.2.p-net-local > 172.26.0.3.5558: Flags [P.], seq 179:181, ack 93, win 229, options [nop,nop,TS val 3569688646 ecr 2755136219], length 2
12:03:56.938994 IP 172.26.0.3.5558 > 172.26.0.2.p-net-local: Flags [.], ack 181, win 227, options [nop,nop,TS val 2755136264 ecr 3569688646], length 0
12:03:57.011974 IP 172.26.0.2.p-net-local > 172.26.0.3.5558: Flags [P.], seq 181:183, ack 93, win 229, options [nop,nop,TS val 3569688719 ecr 2755136264], length 2
12:03:57.012055 IP 172.26.0.3.5558 > 172.26.0.2.p-net-local: Flags [.], ack 183, win 227, options [nop,nop,TS val 2755136337 ecr 3569688719], length 0
12:03:57.029791 IP 172.26.0.2.p-net-local > 172.26.0.3.5558: Flags [P.], seq 183:185, ack 93, win 229, options [nop,nop,TS val 3569688736 ecr 2755136337], length 2
12:03:57.029868 IP 172.26.0.3.5558 > 172.26.0.2.p-net-local: Flags [.], ack 185, win 227, options [nop,nop,TS val 2755136354 ecr 3569688736], length 0
12:03:57.115407 IP 172.26.0.2.p-net-local > 172.26.0.3.5558: Flags [P.], seq 185:187, ack 93, win 229, options [nop,nop,TS val 3569688822 ecr 2755136354], length 2
12:03:57.115720 IP 172.26.0.3.5558 > 172.26.0.2.p-net-local: Flags [.], ack 187, win 227, options [nop,nop,TS val 2755136440 ecr 3569688822], length 0
12:03:57.129748 IP 172.26.0.2.36236 > 172.26.0.4.5557: Flags [S], seq 2746567138, win 29200, options [mss 1460,sackOK,TS val 3997112399 ecr 0,nop,wscale 7], length 0
12:03:57.129835 IP 172.26.0.4.5557 > 172.26.0.2.36236: Flags [R.], seq 0, ack 2746567139, win 0, length 0
12:03:57.150407 IP 172.26.0.2.p-net-local > 172.26.0.3.5558: Flags [P.], seq 187:189, ack 93, win 229, options [nop,nop,TS val 3569688857 ecr 2755136440], length 2
12:03:57.150742 IP 172.26.0.3.5558 > 172.26.0.2.p-net-local: Flags [.], ack 189, win 227, options [nop,nop,TS val 2755136475 ecr 3569688857], length 0
12:03:57.157891 IP 172.26.0.2.p-net-local > 172.26.0.3.5558: Flags [P.], seq 189:191, ack 93, win 229, options [nop,nop,TS val 3569688864 ecr 2755136475], length 2
12:03:57.157969 IP 172.26.0.3.5558 > 172.26.0.2.p-net-local: Flags [.], ack 191, win 227, options [nop,nop,TS val 2755136483 ecr 3569688864], length 0
12:03:57.237985 IP 172.26.0.2.p-net-local > 172.26.0.3.5558: Flags [P.], seq 191:193, ack 93, win 229, options [nop,nop,TS val 3569688945 ecr 2755136483], length 2
12:03:57.238067 IP 172.26.0.3.5558 > 172.26.0.2.p-net-local: Flags [.], ack 193, win 227, options [nop,nop,TS val 2755136563 ecr 3569688945], length 0
12:03:57.243079 IP 172.26.0.2.36238 > 172.26.0.4.5557: Flags [S], seq 2577702232, win 29200, options [mss 1460,sackOK,TS val 3997112512 ecr 0,nop,wscale 7], length 0
12:03:57.243179 IP 172.26.0.4.5557 > 172.26.0.2.36238: Flags [R.], seq 0, ack 2577702233, win 0, length 0
12:03:57.255744 IP 172.26.0.2.p-net-local > 172.26.0.3.5558: Flags [P.], seq 193:195, ack 93, win 229, options [nop,nop,TS val 3569688962 ecr 2755136563], length 2
12:03:57.255826 IP 172.26.0.3.5558 > 172.26.0.2.p-net-local: Flags [.], ack 195, win 227, options [nop,nop,TS val 2755136580 ecr 3569688962], length 0
12:03:57.291906 IP 172.26.0.2.p-net-local > 172.26.0.3.5558: Flags [P.], seq 195:197, ack 93, win 229, options [nop,nop,TS val 3569688998 ecr 2755136580], length 2
12:03:57.291992 IP 172.26.0.3.5558 > 172.26.0.2.p-net-local: Flags [.], ack 197, win 227, options [nop,nop,TS val 2755136617 ecr 3569688998], length 0
12:03:57.335723 IP 172.26.0.2.p-net-local > 172.26.0.3.5558: Flags [P.], seq 197:199, ack 93, win 229, options [nop,nop,TS val 3569689042 ecr 2755136617], length 2
12:03:57.335801 IP 172.26.0.3.5558 > 172.26.0.2.p-net-local: Flags [.], ack 199, win 227, options [nop,nop,TS val 2755136660 ecr 3569689042], length 0
12:03:57.372293 IP 172.26.0.2.p-net-local > 172.26.0.3.5558: Flags [P.], seq 199:201, ack 93, win 229, options [nop,nop,TS val 3569689079 ecr 2755136660], length 2
12:03:57.372379 IP 172.26.0.3.5558 > 172.26.0.2.p-net-local: Flags [.], ack 201, win 227, options [nop,nop,TS val 2755136697 ecr 3569689079], length 0
12:03:57.423717 IP 172.26.0.2.36240 > 172.26.0.4.5557: Flags [S], seq 1287355012, win 29200, options [mss 1460,sackOK,TS val 3997112693 ecr 0,nop,wscale 7], length 0
12:03:57.423763 IP 172.26.0.4.5557 > 172.26.0.2.36240: Flags [R.], seq 0, ack 1287355013, win 0, length 0
12:03:57.452935 IP 172.26.0.2.p-net-local > 172.26.0.3.5558: Flags [P.], seq 201:203, ack 93, win 229, options [nop,nop,TS val 3569689160 ecr 2755136697], length 2
12:03:57.453003 IP 172.26.0.3.5558 > 172.26.0.2.p-net-local: Flags [.], ack 203, win 227, options [nop,nop,TS val 2755136778 ecr 3569689160], length 0
12:03:57.526994 IP 172.26.0.2.p-net-local > 172.26.0.3.5558: Flags [P.], seq 203:205, ack 93, win 229, options [nop,nop,TS val 3569689234 ecr 2755136778], length 2
12:03:57.527078 IP 172.26.0.3.5558 > 172.26.0.2.p-net-local: Flags [.], ack 205, win 227, options [nop,nop,TS val 2755136852 ecr 3569689234], length 0
12:03:57.598156 IP 172.26.0.2.36242 > 172.26.0.4.5557: Flags [S], seq 1511855213, win 29200, options [mss 1460,sackOK,TS val 3997112868 ecr 0,nop,wscale 7], length 0
12:03:57.598200 IP 172.26.0.4.5557 > 172.26.0.2.36242: Flags [R.], seq 0, ack 1511855214, win 0, length 0
12:03:57.616833 IP 172.26.0.2.p-net-local > 172.26.0.3.5558: Flags [P.], seq 205:207, ack 93, win 229, options [nop,nop,TS val 3569689323 ecr 2755136852], length 2
12:03:57.616906 IP 172.26.0.3.5558 > 172.26.0.2.p-net-local: Flags [.], ack 207, win 227, options [nop,nop,TS val 2755136942 ecr 3569689323], length 0
12:03:57.686872 IP 172.26.0.2.p-net-local > 172.26.0.3.5558: Flags [P.], seq 207:209, ack 93, win 229, options [nop,nop,TS val 3569689393 ecr 2755136942], length 2
12:03:57.686935 IP 172.26.0.3.5558 > 172.26.0.2.p-net-local: Flags [.], ack 209, win 227, options [nop,nop,TS val 2755137012 ecr 3569689393], length 0
12:03:57.733423 IP 172.26.0.2.36244 > 172.26.0.4.5557: Flags [S], seq 1037379610, win 29200, options [mss 1460,sackOK,TS val 3997113003 ecr 0,nop,wscale 7], length 0
12:03:57.733609 IP 172.26.0.4.5557 > 172.26.0.2.36244: Flags [R.], seq 0, ack 1037379611, win 0, length 0
12:03:57.778740 IP 172.26.0.2.p-net-local > 172.26.0.3.5558: Flags [P.], seq 209:211, ack 93, win 229, options [nop,nop,TS val 3569689485 ecr 2755137012], length 2
12:03:57.778820 IP 172.26.0.3.5558 > 172.26.0.2.p-net-local: Flags [.], ack 211, win 227, options [nop,nop,TS val 2755137103 ecr 3569689485], length 0
12:03:57.815114 IP 172.26.0.2.p-net-local > 172.26.0.3.5558: Flags [P.], seq 211:213, ack 93, win 229, options [nop,nop,TS val 3569689522 ecr 2755137103], length 2
12:03:57.815218 IP 172.26.0.3.5558 > 172.26.0.2.p-net-local: Flags [.], ack 213, win 227, options [nop,nop,TS val 2755137140 ecr 3569689522], length 0
12:03:57.855032 IP 172.26.0.2.p-net-local > 172.26.0.3.5558: Flags [P.], seq 213:215, ack 93, win 229, options [nop,nop,TS val 3569689562 ecr 2755137140], length 2
12:03:57.855095 IP 172.26.0.3.5558 > 172.26.0.2.p-net-local: Flags [.], ack 215, win 227, options [nop,nop,TS val 2755137180 ecr 3569689562], length 0
12:03:57.871232 IP 172.26.0.2.p-net-local > 172.26.0.3.5558: Flags [P.], seq 215:217, ack 93, win 229, options [nop,nop,TS val 3569689578 ecr 2755137180], length 2
12:03:57.871358 IP 172.26.0.3.5558 > 172.26.0.2.p-net-local: Flags [.], ack 217, win 227, options [nop,nop,TS val 2755137196 ecr 3569689578], length 0
12:03:57.901551 IP 172.26.0.2.p-net-local > 172.26.0.3.5558: Flags [P.], seq 217:219, ack 93, win 229, options [nop,nop,TS val 3569689608 ecr 2755137196], length 2
12:03:57.901677 IP 172.26.0.3.5558 > 172.26.0.2.p-net-local: Flags [.], ack 219, win 227, options [nop,nop,TS val 2755137226 ecr 3569689608], length 0
12:03:57.935518 IP 172.26.0.2.36246 > 172.26.0.4.5557: Flags [S], seq 3747228006, win 29200, options [mss 1460,sackOK,TS val 3997113205 ecr 0,nop,wscale 7], length 0
12:03:57.935594 IP 172.26.0.4.5557 > 172.26.0.2.36246: Flags [R.], seq 0, ack 3747228007, win 0, length 0
12:03:57.941864 IP 172.26.0.2.p-net-local > 172.26.0.3.5558: Flags [P.], seq 219:221, ack 93, win 229, options [nop,nop,TS val 3569689648 ecr 2755137226], length 2
12:03:57.941968 IP 172.26.0.3.5558 > 172.26.0.2.p-net-local: Flags [.], ack 221, win 227, options [nop,nop,TS val 2755137267 ecr 3569689648], length 0
12:03:57.960855 IP 172.26.0.2.p-net-local > 172.26.0.3.5558: Flags [P.], seq 221:223, ack 93, win 229, options [nop,nop,TS val 3569689667 ecr 2755137267], length 2
12:03:57.960954 IP 172.26.0.3.5558 > 172.26.0.2.p-net-local: Flags [.], ack 223, win 227, options [nop,nop,TS val 2755137286 ecr 3569689667], length 0
12:03:57.989875 IP 172.26.0.2.p-net-local > 172.26.0.3.5558: Flags [P.], seq 223:225, ack 93, win 229, options [nop,nop,TS val 3569689696 ecr 2755137286], length 2
12:03:57.989995 IP 172.26.0.3.5558 > 172.26.0.2.p-net-local: Flags [.], ack 225, win 227, options [nop,nop,TS val 2755137315 ecr 3569689696], length 0
12:03:58.036791 IP 172.26.0.2.p-net-local > 172.26.0.3.5558: Flags [P.], seq 225:227, ack 93, win 229, options [nop,nop,TS val 3569689743 ecr 2755137315], length 2
